{
  "protocol_version": "action-0.2",
  "decision": {
    "title": "Illustrative library outreach bounded-assurance case",
    "question": "Which reversible outreach path, if any, is eligible for a six-week pilot?",
    "owner": "Example public-library program team",
    "cutoff": "Illustrative inputs; no real field data",
    "horizon": "Six-week pilot with review before continuation",
    "baseline_option_id": "current_flyers"
  },
  "scenarios": [
    {"id": "digital_access_high", "label": "Target community has reliable digital access"},
    {"id": "digital_access_low", "label": "Target community has limited digital access"}
  ],
  "worldviews": [
    {
      "id": "survey_view",
      "label": "Recent survey interpretation",
      "weight": {"low": 0.5, "central": 1.0, "high": 1.5},
      "scenario_probabilities": {"digital_access_high": 0.7, "digital_access_low": 0.3},
      "probability_concentration": 40
    },
    {
      "id": "frontline_view",
      "label": "Frontline staff interpretation",
      "weight": {"low": 0.5, "central": 1.0, "high": 1.5},
      "scenario_probabilities": {"digital_access_high": 0.4, "digital_access_low": 0.6},
      "probability_concentration": 40
    }
  ],
  "criteria": [
    {"id": "reach", "label": "New participant reach", "weight": {"low": 2.0, "central": 3.0, "high": 4.0}},
    {"id": "access", "label": "Equitable access", "weight": {"low": 1.5, "central": 2.0, "high": 3.5}}
  ],
  "stakeholders": [
    {"id": "underserved_residents", "label": "Underserved residents", "weight": {"low": 2.0, "central": 3.0, "high": 4.0}},
    {"id": "staff", "label": "Library staff", "weight": {"low": 0.8, "central": 1.0, "high": 1.5}}
  ],
  "options": [
    {"id": "current_flyers", "label": "Continue current flyers", "reversible": true, "risk_level": "low", "action_type": "fixed"},
    {"id": "digital_messages", "label": "Pilot targeted digital messages", "reversible": true, "risk_level": "low", "action_type": "pilot"},
    {"id": "partner_popups", "label": "Pilot partner-site pop-ups", "reversible": true, "risk_level": "low", "action_type": "pilot"}
  ],
  "evidence": [
    {"id": "e_current", "label": "Current-format administrative record", "source": "Illustrative library record", "independence_group": "administrative", "quality": "moderate", "status": "supporting"},
    {"id": "e_survey", "label": "Community access survey", "source": "Illustrative survey", "independence_group": "survey", "quality": "moderate", "status": "supporting"},
    {"id": "e_staff", "label": "Frontline staff observations", "source": "Illustrative staff elicitation", "independence_group": "staff", "quality": "moderate", "status": "supporting"},
    {"id": "e_residents", "label": "Resident advisory feedback", "source": "Illustrative advisory session", "independence_group": "resident_panel", "quality": "weak", "status": "supporting"}
  ],
  "consequences": [
    {"option_id":"current_flyers","scenario_id":"digital_access_high","stakeholder_id":"underserved_residents","criterion_id":"reach","estimate":{"low":0,"central":0,"high":0},"uncertainty_group":"baseline","evidence_ids":["e_current"]},
    {"option_id":"current_flyers","scenario_id":"digital_access_high","stakeholder_id":"underserved_residents","criterion_id":"access","estimate":{"low":0,"central":0,"high":0},"uncertainty_group":"baseline","evidence_ids":["e_current"]},
    {"option_id":"current_flyers","scenario_id":"digital_access_high","stakeholder_id":"staff","criterion_id":"reach","estimate":{"low":0,"central":0,"high":0},"uncertainty_group":"baseline","evidence_ids":["e_current"]},
    {"option_id":"current_flyers","scenario_id":"digital_access_high","stakeholder_id":"staff","criterion_id":"access","estimate":{"low":0,"central":0,"high":0},"uncertainty_group":"baseline","evidence_ids":["e_current"]},
    {"option_id":"current_flyers","scenario_id":"digital_access_low","stakeholder_id":"underserved_residents","criterion_id":"reach","estimate":{"low":0,"central":0,"high":0},"uncertainty_group":"baseline","evidence_ids":["e_current"]},
    {"option_id":"current_flyers","scenario_id":"digital_access_low","stakeholder_id":"underserved_residents","criterion_id":"access","estimate":{"low":0,"central":0,"high":0},"uncertainty_group":"baseline","evidence_ids":["e_current"]},
    {"option_id":"current_flyers","scenario_id":"digital_access_low","stakeholder_id":"staff","criterion_id":"reach","estimate":{"low":0,"central":0,"high":0},"uncertainty_group":"baseline","evidence_ids":["e_current"]},
    {"option_id":"current_flyers","scenario_id":"digital_access_low","stakeholder_id":"staff","criterion_id":"access","estimate":{"low":0,"central":0,"high":0},"uncertainty_group":"baseline","evidence_ids":["e_current"]},

    {"option_id":"digital_messages","scenario_id":"digital_access_high","stakeholder_id":"underserved_residents","criterion_id":"reach","estimate":{"low":25,"central":55,"high":75},"uncertainty_group":"digital_high","evidence_ids":["e_survey","e_residents"]},
    {"option_id":"digital_messages","scenario_id":"digital_access_high","stakeholder_id":"underserved_residents","criterion_id":"access","estimate":{"low":-5,"central":25,"high":50},"uncertainty_group":"digital_high","evidence_ids":["e_survey","e_residents"]},
    {"option_id":"digital_messages","scenario_id":"digital_access_high","stakeholder_id":"staff","criterion_id":"reach","estimate":{"low":10,"central":35,"high":55},"uncertainty_group":"digital_high","evidence_ids":["e_staff"]},
    {"option_id":"digital_messages","scenario_id":"digital_access_high","stakeholder_id":"staff","criterion_id":"access","estimate":{"low":-10,"central":10,"high":30},"uncertainty_group":"digital_high","evidence_ids":["e_staff"]},
    {"option_id":"digital_messages","scenario_id":"digital_access_low","stakeholder_id":"underserved_residents","criterion_id":"reach","estimate":{"low":-55,"central":-20,"high":10},"uncertainty_group":"digital_low","evidence_ids":["e_survey","e_residents"]},
    {"option_id":"digital_messages","scenario_id":"digital_access_low","stakeholder_id":"underserved_residents","criterion_id":"access","estimate":{"low":-75,"central":-45,"high":-5},"uncertainty_group":"digital_low","evidence_ids":["e_survey","e_residents"]},
    {"option_id":"digital_messages","scenario_id":"digital_access_low","stakeholder_id":"staff","criterion_id":"reach","estimate":{"low":-15,"central":5,"high":25},"uncertainty_group":"digital_low","evidence_ids":["e_staff"]},
    {"option_id":"digital_messages","scenario_id":"digital_access_low","stakeholder_id":"staff","criterion_id":"access","estimate":{"low":-35,"central":-10,"high":15},"uncertainty_group":"digital_low","evidence_ids":["e_staff"]},

    {"option_id":"partner_popups","scenario_id":"digital_access_high","stakeholder_id":"underserved_residents","criterion_id":"reach","estimate":{"low":10,"central":35,"high":60},"uncertainty_group":"popups_high","evidence_ids":["e_staff","e_residents"]},
    {"option_id":"partner_popups","scenario_id":"digital_access_high","stakeholder_id":"underserved_residents","criterion_id":"access","estimate":{"low":20,"central":45,"high":70},"uncertainty_group":"popups_high","evidence_ids":["e_staff","e_residents"]},
    {"option_id":"partner_popups","scenario_id":"digital_access_high","stakeholder_id":"staff","criterion_id":"reach","estimate":{"low":-20,"central":5,"high":25},"uncertainty_group":"popups_high","evidence_ids":["e_staff"]},
    {"option_id":"partner_popups","scenario_id":"digital_access_high","stakeholder_id":"staff","criterion_id":"access","estimate":{"low":-10,"central":10,"high":30},"uncertainty_group":"popups_high","evidence_ids":["e_staff"]},
    {"option_id":"partner_popups","scenario_id":"digital_access_low","stakeholder_id":"underserved_residents","criterion_id":"reach","estimate":{"low":20,"central":50,"high":75},"uncertainty_group":"popups_low","evidence_ids":["e_staff","e_residents"]},
    {"option_id":"partner_popups","scenario_id":"digital_access_low","stakeholder_id":"underserved_residents","criterion_id":"access","estimate":{"low":35,"central":65,"high":85},"uncertainty_group":"popups_low","evidence_ids":["e_staff","e_residents"]},
    {"option_id":"partner_popups","scenario_id":"digital_access_low","stakeholder_id":"staff","criterion_id":"reach","estimate":{"low":-45,"central":-15,"high":10},"uncertainty_group":"popups_low","evidence_ids":["e_staff"]},
    {"option_id":"partner_popups","scenario_id":"digital_access_low","stakeholder_id":"staff","criterion_id":"access","estimate":{"low":-25,"central":0,"high":20},"uncertainty_group":"popups_low","evidence_ids":["e_staff"]}
  ],
  "challenges": [
    {"id": "c_parameter", "label": "Consequence and value range stress", "type": "parameter", "status": "tested", "method": "Triangular sampling over declared ranges"},
    {"id": "c_coverage", "label": "Omitted outreach barrier challenge", "type": "model_coverage", "status": "bounded", "method": "Resident and staff review of missing access barriers"},
    {"id": "c_stakeholder", "label": "Concentrated burden challenge", "type": "stakeholder", "status": "tested", "method": "Per-stakeholder outcomes and minimum-score constraint"},
    {"id": "c_temporal", "label": "Pilot lock-in and stopping-latency challenge", "type": "temporal", "status": "tested", "method": "Six-week limit, weekly monitoring, and stop rules"}
  ],
  "deficits": [
    {"id": "d_nonresponse", "description": "Survey nonresponse may underrepresent residents with the lowest digital access.", "type": "evidence", "severity": "medium", "status": "open"},
    {"id": "d_real_data", "description": "All values in this packet are illustrative rather than observed field estimates.", "type": "external_validity", "severity": "blocker", "status": "accepted"}
  ],
  "constraints": [
    {"id": "underserved_floor", "type": "minimum_stakeholder_score", "stakeholder_id": "underserved_residents", "threshold": -20, "max_violation_probability": 0.1}
  ],
  "assurance": {